id,title,date,journal
NCT01967433,use of diphenhydramine as an adjunctive sedative for colonoscopy in patients chronically on opioids,2020-01-01,journal of emergency nursing
NCT04189588,phase 2 study iv quzyttir cetirizine hydrochloride injection vs v diphenhydramine,2020-01-01,journal of emergency nursing
NCT04237090,,2020-01-01,journal of emergency nursing
NCT04237091,feasibility of a randomized controlled clinical trial comparing the use of cetirizine to replace diphenhydramine in the prevention of reactions related to paclitaxel,2020-01-01,journal of emergency nursing
NCT04153396,preemptive infiltration with betamethasone and ropivacaine for postoperative pain in laminoplasty or xc3xb1 laminectomy,2020-01-01,hôpitaux universitaires de genève
NCT03490942,glucagon infusion in t1d patients with recurrent severe hypoglycemia effects on counterregulatory responses,2020-05-25,nan
,glucagon infusion in t1d patients with recurrent severe hypoglycemia effects on counterregulatory responses,2020-05-25,journal of emergency nursing
NCT04188184,tranexamic acid versus epinephrine during exploratory tympanotomy,2020-04-27,journal of emergency nursingxc3x28
